{
  "asset_id": "anatomy_lumbar_lateral_v1",
  "body_part_slug": "lumbar",
  "body_part_ko": "요부",
  "view_angle": "lateral",
  "source": "Custom (in-house)",
  "source_url": "https://chatgpt.com",
  "license": "CC0",
  "license_url": "https://creativecommons.org/publicdomain/zero/1.0/",
  "attribution_text": "Custom (in-house) licensed under CC0",
  "downloaded_at": "2026-05-04",
  "file_path": "data/anatomy/lumbar/source_lateral.png",
  "modifications": "",
  "acupoints": [],
  "notes": "ChatGPT(DALL-E) 생성 — 요추 5분절 + 천골 + 미골 측면 모형, 신경근 노란색"
}
